People,Comments
CodingMadeClear,"This guy, sat for 1 hour and talked about python, and then released it for free. legend"
Snipy 🔧,I'm literally only like 5 minutes in and this is making more sense then my weeks of classes. Sir you are amazing. You need to win some sort of award for the service you are doing for the millions of people watching. You are opening doors and potential futures for people. This could be life changing. You gained a subscriber.
Sam,My tiny brain can't comprehend how you crammed so much information into such a short timespan and still made it easily understandable. Thank you so much for this tutorial and I hope this will be the start of a coding passion for me.
Tatiana Alexandrovitch,"Excellent course! The concept is very clear and great presentation as well. I spent hours watching other courses and learned much less than I have learned with you in this short course. It is a ""crash course on steroids"" that teaches a lot of great information, and it is easy to follow. You have one more subscriber now. I am going to get your full course (for certification purposes). Thank you so much, Mosh!"
Anu GB,"Very very clear content and presentation. I have attended other 1 hour python courses and i was still confused on so many concepts, but this course is really good and gives no space for any such confusions. Thanks a lot. I would really sign up for an advanced course shortly as i am prepping for python certifications."
TheRacingRoo,This is exactly what I needed for my college course work. Learned C++ but a year later need to know python for a project. This helps so much and goes quick enough so I’m not bored but also slow enough that I can try it out myself. Thanks so much!
Dalia Ibrahim,"I really learned a lot from this video. Your voice, organization and one step at a time approach have encouraged me to learn more and more. I didn't feel tense at all. On the contrary, I felt it went smoothly and easily. Thank you so much."
F1 meme lord,"I am taking GCSE computer science and one of the main tips i got was to learn to code. Watching this one hour tutorial, I have learned more in two hours than I did in 5 lessons of python tutoring at school. Thanks mosh."
Karrie Melody,"Great tutorial! Thank you so much!
Converter task:

weight = int(input(""Your current weight: ""))"
Soaphy,"Exercice 8:50

Name = (""John Smith"")

Age = 20"
Lanre Odusina,"Wonderful work done here sir. Well explained and easy to understand... Showing us the errors and how to rectify them is just superb it gives us a better understanding rather. 
Is this coding for creating website or applications?"
Ubong,"As a programming newbie, I can say that this has simplified Python to a point that I am wholly interested. Awesome job, Mosh!!"
Beamer B,"Learning for the data science realm. I watched your SQL course and it was amazing. Thank you for being so clear and concise with your explanations. Most YouTube instructors, or instructors in general, don’t share the “why you shouldn’t do something a certain way,” but you do. I feel job ready after watching your videos. Thank you for being awesome."
ice,"Hi Mosh, thank you so much for this video!
 i was curious about python and I'm super interested when I learned that it was so useful in many fields, especially now in my chosen degree. I actually watched this video so that I could have a bit of knowledge in the future since python is quite used in many areas and also in some job positions that I'm aiming in the future after I graduate. Thanks for making this, you've certainly helped a lot of people including me  <3"
How mathematicians create maths,"Hey Mosh! ;) 

As a mathematician I´m now finally interested in the IT world also and discovered your Video and you truly motivated me to learn Python."
Super PantMan,I watched the whole thing. As stated its only for beginners but its very easy to follow and flows nicely to cover many topics within an hour. Excellent work.
HOC Fashions,"Thanks Mosh for this amazing material.️

Please I have a question, why do we have to use  unit.upper in your solution for the third exercise?"
Paul Aulridge Jr,"Now THIS is superlative instruction; teach a concept, and then demonstrate it. That you include errors is a stroke of genius! The nuances of programming languages can be difficult to understand at first, but by showing things going WRONG, you also show how to CORRECT the mistakes. This is just brilliant work. Thank you! Subscribed as hell!"
Line,"This is amazing, very easy to understand and i really loved there was assignment along the way to try out what you have learned <3"
Timothy Abidoye,"1 First = input(""First: "")
2 Second = input(""Second: "")
3 Sum = Float(First) + Float(Second)
4 print(""Sum: "" + Str(Sum))"
CM D,"This was really helpful. I now have an idea of python, and feel ready to learn even more.
Thank you !"
Thomas Ling,"Truth be told this course has been pretty helpful, and gave me a really nice and quick revision of python basics. Thank you!"
Kakad00,"You're like one of those good teachers that lead your students towards a mistake to teach them what and how something could go wrong then, teach how to do it properly. Loving this."
Petri Lautamäki,3 minutes in and I'm already really appreciating the fact that you have taken into consideration that not everyone uses Mac and some uses Windows. It's a simple thing but so often forgotten.
Hal Harrison,"Also, for newcomers: I found it helpful to reduce playback speed to .75 in settings, and turn on CC.  The material goes fast, and this trick made it much easier to absorb the material."
Paul Preston,"My code for 15:08

First = float(input(""First: ""))

Second = float(input(""Second: ""))"
Les Ryder,Brilliant. Im amazed at the similarities of basic. So well presented.
R35T Man,Thank you for creating this detailed tutorial for beginners.
ernesto garcia,I'm learning because i want a better job than driving a school bus.
Farheen khan,Hey!   A very beautiful  and simple way of teaching. Thank you for teaching me Python
Ocean's day,Thanks for this amazing tutorial. You just saved months of learning .
Patrick Fisher,This is a million times better than the 100 days of code on Udemy class taught by Angela. Much clearer and concise especially if you do not have a background in this.
Pohaku,"I have always been interested in coding but never have actually tried it, I'm 13 minutes into this video and I am practicing/learning for the first time & I am already learning and having fun, thank you so much man!"
Smart Finance Army,"Hey Mosh. This is my first time on Python. You made me love it.
I have held the Python plough, I ain't looking back.
You are an amazing teacher. Thank you."
yourhost,You have teaching magic! I’ve never been able to learn from a coding video so easily
Hal Harrison,"I keep coming back to this resource as I go in my journey of learning Python.  It has been invaluable, you have my sincere gratitude!"
Lily B.,I finally find a teacher that explain python so clear. Thanks a lot
Ken Charles,"I cant believe i spent up to 2 hours watching and practicing with this tutorial, and i enjoyed it. I love the exercise section, its inspiring. Thanks for taking your time to give this tutorial."
HAZARDOUS STORM,"Honestly Sir,  it really helped me understand python basics. Thank You so much"
Paul Joneseyboy,"Best tutorial I have ever seen thanks so much, I’ll do the full course ASAP"
Efitri Apriliyan,"i'm beginner. this is my first time starting to learn programming. hope everything going well, and this video is my first source of learning python!"
Obla Vishvesh,"Thank you Mosh for this wonderful, easy to learn python tutorial."
AG,Mosh explains everything thoroughly and never misses on a single part. He has challenges for us so that we take what we learned in the past and implement it in our code. I am still in the middle of the course but I can say that this channel is the #1 channel for those who want to learn to code! Keep it up!!
Juanita Jewett,"You have made me so happy I could cry, I am retaking a class that involves learning Python. I struggled so bad in that class. failing this class put me on academic probation because we have to maintain a 3.0 or higher.  YOU MADE This super Easy. I know I am going to pass this class for sure this time. You even showed how to look for what you did wrong that is so fantastic. I am Subscriber for Life Sir."
امیرمهدی داودی,"You're wonderful Mosh 
I'm learning lots of great things here"
M M,"Proud to say, I took notes and watched the entire video. Despite not knowing anything about coding. I learned a lot. Thanks!"
Pp,Thanks sir as a 8th STD student it was very difficult for me to learn coding but you made it really easy
Janice Lim,"as someone who legit struggled for a few years trying to start learning python, trying to understand and comprehend python because it's too technical, this has made learning python a whole lot more easier and digestible compared to self learning on Kaggle, etc. Thanks a bunch Mosh for making learning feel easier!!"
Market analyst 📉,"Thanks mosh because of your simplified way of teaching I learn python programming.

Wishing you ATB"
Kunal Kheeva,It was a productive lecture. Thank you!
Mahendrasinh Parmar,I really impressed by the python programming information given in 1 hours video without wasting not a minute time and explained each concept very nicely with examples. Thanks .
CeeloThatMane,"Man this is so easy. After all of this time of trying to figure out where to learn coding and I simply just typed in “python” and found a video with the easiest breakdown I could ever find. 

Much appreciated. I’m a complete noob. Never coded in my life outside of coding apps in high school with those little puzzle piece coding software we used. It was trash"
RhythmFog,Appreciate the time you put into this video for us.
Ravindranath Menon,Excellent tutorial. Interspersing each lesson immediately with an example is a wonderful way of teaching. You really hit the nail on its head. Thank you for this painstaking effort. Looking forward to your other tutorials. My best wishes in all your endeavours.
Veraleee,Okay! I loved this video. Thank you for putting this great content together.
Euan restricted,im so thankful for this tutorial sir mosh great more tutorials to come
Daniel Delgado,"This was really fantastic. I have no prior Python experience and was able to keep up and even experiment a little during the exercises. Thank you so much!!

8:50"
RiceDork,"This is amazing! So far I'm on the Weight converter exercise and I noticed a difference between ours which I can assume to either be an ""I'm sure you guys are smart enough to figure out something new for yourselves/I'm sure these guys will be excited to figure something out"" or simply an oversight (which happens). I realized you used else rather than elif resulting in an ""if not K, anything other letter"" will work situation. Here's mine:"
Sufyan,i just need to catch up my first year of computer science in highschool
Gogi King,"Hi. I am genuinely interested in learning Python and your videos are amazing.
exercise numero 1:
name = (""john Smith"")

age = 20"
melica sd,"Hi, I'm almost at the end of the video and I just wanted to let you know how grateful I am for this amazing video. I will dive deep into your channel very soon"
Crazy Titan X Army,YOUR TEACHING SKILL IS NEXT LEVEL
Ryan Shayegan,Amazing introduction to Python! Bravo Mosh
manpreet singh Saini,"thanks sir for such a great video for beginners
 I really appreciate your hard work!"
Chats with Fred,"Thank you so much, 100% beneficial for me. Liked and subscribed!"
Banus,I really love how well this was made and you made variables MUCH easier to understand and to make
Ishaan Naolekar,i just completed everything in here and its truly amazing like an hour ago  i had no idea what python is and after seeing this video i can start to code python thanks MOSH
Mint Toast,You are an awesome teacher I learned so much!
Chief Skittlez,Thank you. I'm a second year Electrical Engineer and this is super convenient since I'm having to teach myself python. (Engineering profs aren't always the best.)
Emabel Esh,"Trying to learn Python for an assessment, this is my first time learning Python. I know I still need to learn much more, but just this has given me a good overview of Python Thank you.
P.S I think it's more straight forward than JS"
social loner,"started learning python with mosh through his YouTube tutorials. I watched the one which is over 6 hours and the other one which is 2 hours.
Mosh explains everything crystal clear. I really had no prior knowledge in programming and this whole programming world or whatsoever. And it seemed very daunting to me. But I gotta say thanks to mosh I started believing that I might be able to actually make it in the programming world."
Carlton Lobo,"It is an amazing tutorial for beginners.
Thank you @chandoo for sharing this in your video"
MUHAMMAD TAHIR NAQASH KHAN,"Great Content Mosh, looking for more precise and straightforward stuff."
Suhani Dosanjh,Thank you so much! I have been wanting to learn how to code Python for so long. This is the only tutorial that has ever taught me. THANK YOUUUUUU
sadath khan,"Thanks, its very useful, clear and simple"
Amaan Khan,"Excellent Course. No distraction, No crap. Just explained with so much ease and comfort. Makes so much sense for every minute of the hour!!!"
Dave Powell,Hi Mosh! My name is Dave Powell & I am learning python b/c I will be taking an algorithm coding class next month. I was told that this class is recommended. Thank you for providing the knowledge. Take care...DPowell
Sandy,"Thank you for this beginner's course, I find it to be very helpful!"
vinodha elangovan,Since I was new in learning codes. Fr yesterday I have started to learn. It is easier as u explain it in simple way. Thank u. And I have tried the coding for if exercise and finally solved after 1 hr.
Bai Wu Li,"Thank you very much! I had my first programming course last week and the teacher didnt even teach us how to use Python because he assumed that its common knowledge just like 1+1. For me, it was like going to a battlefield without knowing how to use a gun."
E T,"I love how every time he says ""Let me show you"" it's unlike any  other teacher trying to explain anything - he does such an good job!"
Keith Marx,Reminds my of my high school days in the 70's learning how to code with Basic on a mainframe!  A lot of the concepts are the same!  Thanks for the video.  I want to learn more!
Shadow Monster,"Thank you very much Mosh, you really lifted my carrier up!"
Ego Cheap,"This is a wonderful video dude. I would watch like twenty or so minutes, then come up with fun things to do with those concepts, then continue. It's a great first video."
DHeepak Chandrashekar,"Hey Mosh, you have been a great tutor.. Would be great if can post many more tutorials on Python"
Mr H - Travelling Teacher,"Mosh, please can you reveal the code for excercise 1. What is the output meant to look like?"
Stephen Wilkinson,"MOSH!, you legend. I've been umming and ahhing over 'learning to code' for years. Prior to this video my coding knowledge could be described as zero. You really set the basic concepts out in an easy to follow way and being able to pause, go back, take notes etc made this format perfect for me to learn my way (I have Asperger's Syndrome and probable ADHD). I'm now familiar with the basic concepts of Python and I'm excited to start coding and playing around before I follow another tutorial of yours. I'm planning to purchase your 12hr Python mastery course if the offer is still at the reduced price in a few days after I get paid. Can't wait to learn more Python with Mosh. Thanks man!."
Mohammed Alramlawi,"Just saved my time, thank you Mosh, I really loved it"
Vin Ling,Currently recovering from TBI an struggle with learning conditions. Your videos are better then the digital book at my online school. Thank you for all your efforts.
baddie bill,These videos are helping me pass/better familiarize my self withpersonal. I'd be struggling even harder if it wasn't for your vids. I can't begin to express how thankful I am
Muhammad Badrul Munir,FULL SUPPORT FOR YOU SIR! YOU'RE MY ANGLE!
Jose A Perez Benitez🇪🇸,My trading journey was a matriculation of high and low literally just like the market. You up and you down. Now I'm constantly up
Kelvin Chibuye,Well I've always have this great interest in programming and later software engineering and I'm learning python for web development
Christopher Ferrer,Yeah he's a really good teacher to show you the difference in the uppercase and lowercase is definitely a definitive concept and important even the spacing sometimes it's difficult to see the spacing
Wensleydale,"This hour-long course was a great refresher for when you've stepped away for a while and need to get back up to speed. Awesome job. Quick, concise, easily understood."
Amandeep S,"Thank you Mosh!!!
I just started with this today.  It's been great and your lectures are helping a lot.

And dear friends why don't you try this interesting code code that traps your system in a never ending loop....."
xal.,"Hi! Thanks for the video! First time trying to learn Python after learning css and html. 

On the first exercise, I googled how to write a conditional statement to output whether he was a new patient or not. I know it only works in this case. Just trying to get use to utilizing different statements and actually getting them to work, lol."
Samreen Naz,sir keep up on the same level of hard work you are a teacher in true words congrats you have got another active and loving subscriber
Junking Junking,"Best beginner tutorial I have seen so far. Thank you, Sir."
Todd Thompson,I just want to say thank you for this. I feel really lucky to have been given this knowledge and it makes me so happy to see truly knowledgeable talented and hardworking individuals be so generous with the information they undoubtedly invested years and  so much hard work to be able to get to the level of understanding they have so as to even be able to speak with such a competent grasp. Again HUGE thank you to you. You are amazing kind sir.
ranch,It is so short yet gives so much information. I 1000% recommend it to beginners
Ilim Abzarov,"Very helpful, Thank you!"
Kenny A OJ,Great content.. thanks a million!
willie sanape,"I'm learning Python for Web Development! 
Thanks for the help!"
Doramus,"Just Started learning Python, Great Tutorial!"
Ramanjaneyulu Mudiraj,I can't just thank you enough Mosh! You're a true legend spending your great time for these free courses. You're definitely an inspiration to the up coming generations of AI labs and desire's of coding.
Prateek Shukla,"this is amazing, thank you for making valuable video"
Dalk:-Cyber_Agency on telegram is the best,Thanks a million times. What a privilege and blessing it is to have you in my life I am forever grateful.
Bleib _r6,you tought me what my gcse teacher couldnt in 3 years in just over an hour. incredible stuff
gothboibussi,"Honestly amazing content! By the time I got to if statements I made my first ""program"" that will give out different responses to user input. Made it really easy to wrap my head around the concepts. I think my first in-depth program is gonna be a choose-your-own adventure type deal.  Thank you so much."
Coral,Learned more then all my months of Python lessons
Jaitan Martini,Thanks very very much! Great teaching skills Sr !
sidney joseph,"Wow, excellent!! Thank you for posting this"
Aspire Automobile,"Print(""Summation calculator"") 
N = input(""Enter first number: "") 
M = input(""Enter second member: "") 
Sum = int(N) + int(M)"
Doonkey Korng,"I wanna learn this for two main reasons:

1.) I’m just simply fascinated by computer science and programming, and realize how great of a skill they are to know in modern times. And I’ve been told many times that Python is generally considered the “easiest” and “widely used” language."
Manon Viau,Python looks so simple to use. So interesting.  Great dynamic voice. Really enjoy this intro. Thank you!
blobe stanoh,"Great 
This has given me all I wanted  to start my career in python programming"
Shivam Sachan,Thank you Mosh for your wonderful contribution
Chase Allen,"This was my take on the weight converter, looks pretty janky but its working ! feedback appreciated; this was done with only knowledge previous to the excersize

print(""Kilograms to Pounds Converter"")"
Esther Mwaura,This is by far the most well explained python code for beginners. Thank you!
Majin,Hey dude you're the shit thank you for taking the time to teach the rest of us. Im actually understanding things now and am not only excited for the future but to see what all i create with this  new found knowledge. I hope for a long and prosperous career. Thank you Mosh
Abdullahi Ahmed,"Hi, I have done GW basic programming 26 years ago; and Python is very quite close to it. So far, I find it pretty easy; but,  I will see when writing
huge projects comes to light. I am impressed by your simple and effective explanation; Thanks a lot for the effort you made."
Vivek Pandey,"Exersice 15:04
first = input(""First: "")

second = input(""Second: "")

sum = float(first) + float(second)"
harvey,"for anyone out there who just got started, even though you could use pycharm this is an old version and I asked my brother if I should use this he said that pycharm isn't that efficient compared to visual studio code. he said that it would be easier since I just got started and not to use pycharm. I will be using that and just wanted to give the advice of a computer science engineer."
Jayvon Bello,This guy made us save $$ for online python courses. Thank you and God bless sir!
Chill LoFi Music | Chilled Shiba,"Thanks! I learned so much from this video, grateful for all the quality content that you've put out. Hope 2022 will be a good coding year :)"
Tom van Dalen,Your explanation is so well done and chill that at 15:00 min exercise I automatically skipped the mistake you showed on purpose. I did however forgot to write the input line the correct way.
Moni Harrion,"Im a newbie in learning python. I want to learn how to use it in gaming, animation and visual effects. Will you have any specific videos for that? Also just subscribed."
WoahMichael,"Exercise 36:17

weight = input('Weight: ')

KL = input('(K)g or (L)bs? ')"
Joe Lara,I graduated with my bachelor's a few months ago and I'm going to apply for a masters in data analytics and I'm brushing up on my Python and this is amazing. Thank you so much for the amazing tutorial!
sara ali,Really nice lesson!
Sebastian Kahl,Very concise yet still easy to follow along with; thank you.
Zeft M3afen,I always tell my self I need to learn Python. I play some videos and I get bored or sleep lol. But not when I'm watching your videos Mosh. I love ur videos and keeps me focused. Truly appreciate it. This video was great to watch.
farlaff,"Hi, Mosh. First, thanks for making these amazing videos. I started going through them about three days ago and already spent about ten hours going back and forth the exercises. I actually regret not having started with this earlier. I have interest in Machine Learning, but that is for the future. For now, I would like to know if I could apply Python for editing E-Books that are going to be published in Kindle, for instance. Many of the formatting in the editions are repetitive and it seems there would be a possibility. If there is, I would like to know more about it. Cheers and all the best."
Adenso,"17:53 i really liked this calculator and i decided to make it a bit pretty as i was doing mine. obviously i had to watch til this point to figure out why i couldnt just simply concatenate the lines of code, but after learning why and fixing it i got here and i like the way it looks"
indiana1120,"Thank you! I've been out of practice for years, and with this video, all of the basics came flooding back to me. Just what I needed"
